<?xml version="1.0" encoding="UTF-8"?>
<empns:employee xmlns:empns="http://www.venkat.com/Employee"
	xmlns:xsi="http://www.w3.org/2001/XMLSchema-instance"
	xsi:schemaLocation="http://www.venkat.com/Employee employee.xsd ">

	<id>007</id>
	<name>Venkat</name>
	<salary>100000000</salary>
	<designation>JA</designation>
	<addressList>
		<address type="Main">
			<city>Hyderabad</city>
			<line1>line1</line1>
			<line2>line2</line2>
			<state>TS</state>
			<zipcode>0</zipcode>
		</address>
		<address type="Main">
			<city>Hyderabad</city>
			<line1>line1</line1>
			<line2>line2</line2>
			<state>TS</state>
			<zipcode>0</zipcode>
		</address>
	</addressList>
</empns:employee>